{
  "key": "esh-kha",
  "name": "Esh-Kha",
  "size": "medium",
  "homeworld": "Unknown, Belsavis (adopted)",
  "nativeLanguage": "Kharan",
  "lore": "### Biology and Appearance\nEsh-kha are a gray-skinned humanoid species with equine features, including muzzles and digitigrade legs. They also have small black eyes.\n\n### Society and Culture\nIn terms of society, their race's culture resembles that of a hive society though each individual retain their own thoughts and aspirations yet all being bred for a specific role that they were eager to fulfill. A caste system is present amongst the esh-kha which included Force-sensitive simple minded savants, more numerous skilled determined warriors that watched over them and finally the patriarchs that acted as leaders who provided their wisdom as well as decisions to their entire people. Esh-kha appear to outsiders as a savage violent species that care only for the destruction of all other races. This hatred for other sentient species is believed to had stemmed from their tightly-knit hive-like society. It is suspected that the esh-kha are simply unable to tolerate or even adapt to the existence of thinking of outsiders who only suffered their wrath. Their race only turns violent against one another in the most extreme of circumstances.\n\n### Names\nWhilst their kind are individuals, esh-kha are not named at birth but instead earn their names through their actions. An esh-kha that displayed great skill in battle could be called \"Swift Blade\", or maybe \"Deadly Cutter\" or some other such name. It is believed that this partly explained an esh-kha's zeal in battle with young warriors seeking not only victory but an opportunity to lay claim to a name and forge their own identity. Esh-kha do not use surnames, as they believe they are one family.\n\n**Names.** Bleeding Yell, Dormant Heart, Blue Survivor, Ancient Cull, Sharp Grip, Running Sun, Flame Walker",
  "traits": [
    {
      "name": "Ability Score Increase",
      "description": "Your Strength or Wisdom score increases by 2, and your Constitution score increases by 1."
    },
    {
      "name": "Age",
      "description": "Esh-kha reach adulthood in their early teens and live less than a century."
    },
    {
      "name": "Alignment",
      "description": "The esh-kha's stubborn and racially-centric mindsets cause them to tend toward lawful balanced, though there are exceptions."
    },
    {
      "name": "Size",
      "description": "Esh-kha typically stand 6 to 6 and a half feet tall and generally weigh about 200 lbs. Regardless of your position in that range, your size is Medium."
    },
    {
      "name": "Speed",
      "description": "Your base walking speed is 30 feet."
    },
    {
      "name": "Darkvision",
      "description": "You have a keen eyesight, especially in the dark. You can see in dim light within 60 feet of you as if it were bright light, and in darkness as if it were dim light. You can't discern color in darkness, only shades of gray."
    },
    {
      "name": "Force-Sensitive",
      "description": "You know your choice of the *turbulence*, *force disarm*, or *slow* at-will force powers. Your forcecasting ability is Wisdom or Charisma (depending on power alignment)."
    },
    {
      "name": "Inquisitive",
      "description": "You have proficiency in the Investigation skill."
    },
    {
      "name": "Savage Attacks",
      "description": "When you score a critical hit with a melee weapon attack, you can roll one of the weapon's damage dice one additional time and add it to the extra damage of the critical hit."
    },
    {
      "name": "Skill Versatility",
      "description": "You gain proficiency in one skill of your choice."
    },
    {
      "name": "Weapon Training",
      "description": "You have proficiency in two vibroweapons or blasters of your choice."
    },
    {
      "name": "Languages",
      "description": "You can speak, read, and write Galactic Basic and Kharan. Kharan contains many metaphorical expressions when translated to Galactic Basic. The language has many comparisons to music and singing, such as a galactic government being compared to a chorus."
    }
  ],
  "abilityScoreIncreaseOptions": [
    {
      "increases": [
        {
          "amount": 2,
          "abilities": [
            "strength",
            "wisdom"
          ]
        },
        {
          "amount": 1,
          "abilities": [
            "constitution"
          ]
        }
      ]
    }
  ],
  "physique": {
    "heightAverage": "5'4\"",
    "heightModifier": "+2d10\"",
    "weightAverage": "145 lb.",
    "weightModifier": "x(2d4) lb."
  },
  "appearance": {
    "distinctions": "Horizontal head protrusions",
    "skinColorOptions": "Gray or tan",
    "hairColorOptions": "Gray",
    "eyeColorOptions": "Black"
  },
  "imageUrls": [
    "https://starwars5ecentral.blob.core.windows.net/site-images/species/species_esh-kha.png"
  ],
  "sourceKey": "ec",
  "contentSet": "expanded-content"
}
